{
  "$schema": "../../schemas/doc-type.schema.v1.json",
  "type_id": "generic",
  "name": "通用文档",
  "description": "最基础的通用文档类型，适用于任何非特定领域的文档。当没有更具体的文档类型时，使用此类型作为默认选择。",
  "version": "1.0.0",
  "author": "MaeDoc",
  "tags": ["general", "universal"],
  "sections": [
    {
      "id": "overview",
      "title": "概述",
      "required": true,
      "description": "简要介绍本文档的目标、背景和范围。帮助读者快速理解文档的目的和适用边界。",
      "subsections": [
        {
          "id": "objective",
          "title": "目标",
          "required": true,
          "description": "明确说明本文档要达成的目标。使用可验证的表述，避免模糊措辞。"
        },
        {
          "id": "background",
          "title": "背景",
          "required": false,
          "description": "提供理解本文档所需的上下文信息。包括相关历史、当前状态或触发本文档的事件。"
        },
        {
          "id": "scope",
          "title": "范围",
          "required": false,
          "description": "界定本文档涵盖的边界。明确指出哪些内容在范围内，哪些不在范围内（非目标）。"
        }
      ]
    },
    {
      "id": "body",
      "title": "正文",
      "required": true,
      "description": "文档的核心内容区域。根据文档主题灵活组织章节，可包含多个自定义子章节。每个子章节应聚焦一个主题，遵循先结论后展开的结构。",
      "subsections": []
    },
    {
      "id": "summary",
      "title": "总结与下一步",
      "required": true,
      "description": "概括文档的核心结论，并列出明确的后续行动项。每个行动项应指定负责人和截止日期（如已知）。",
      "subsections": [
        {
          "id": "key-conclusions",
          "title": "关键结论",
          "required": true,
          "description": "以要点形式列出 3-5 条核心结论或关键信息。每条结论应独立、可验证。"
        },
        {
          "id": "next-steps",
          "title": "下一步行动",
          "required": false,
          "description": "列出具体的后续行动项，包括负责人和截止日期。如信息未知，标注为未指定。"
        }
      ]
    },
    {
      "id": "appendix",
      "title": "附录",
      "required": false,
      "description": "补充材料区域，包括参考资料、相关链接、术语表、数据表格等。不影响主文档阅读的支撑性内容放在此处。",
      "subsections": [
        {
          "id": "references",
          "title": "参考资料",
          "required": false,
          "description": "列出本文档引用的外部资料，包括文档链接、标准规范、工具文档等。"
        },
        {
          "id": "glossary",
          "title": "术语表",
          "required": false,
          "description": "定义文档中使用的专业术语、缩写或特定词汇，帮助不熟悉背景的读者理解。"
        }
      ]
    }
  ],
  "variables": {
    "document_title": {
      "type": "string",
      "required": true,
      "description": "文档标题"
    },
    "author": {
      "type": "string",
      "required": false,
      "description": "文档作者姓名",
      "default": "未指定"
    },
    "date": {
      "type": "string",
      "required": false,
      "description": "文档日期，格式 YYYY-MM-DD",
      "default": "未指定"
    },
    "version": {
      "type": "string",
      "required": false,
      "description": "文档版本号",
      "default": "1.0.0"
    },
    "status": {
      "type": "string",
      "required": false,
      "description": "文档状态：草稿 / 审阅中 / 已发布",
      "default": "草稿"
    }
  },
  "writing_guidelines": "guidelines.md",
  "output_format": "markdown"
}
